,name,story,genre
0,1. Nosferatu,"A gothic tale of obsession between a haunted young woman and the terrifying vampire infatuated with her, causing untold horror in its wake.",Fantansy
1,2. Sonic the Hedgehog 3,"Sonic, Knuckles, and Tails reunite against a powerful new adversary, Shadow, a mysterious villain with powers unlike anything they have faced before. With their abilities outmatched, Team Sonic must seek out an unlikely alliance.",Fantansy
2,3. Wicked,"Elphaba, a misunderstood young woman because of her green skin, and Galinda, a popular girl, become friends at Shiz University in the Land of Oz. After an encounter with the Wonderful Wizard of Oz, their friendship reaches a crossroads.",Fantansy
3,4. Mufasa: The Lion King,"Mufasa, a cub lost and alone, meets a sympathetic lion named Taka, the heir to a royal bloodline. The chance meeting sets in motion an expansive journey of a group of misfits searching for their destiny.",Fantansy
4,5. Better Man,"The meteoric rise, dramatic fall, and remarkable resurgence of British pop superstar Robbie Williams.",Fantansy
5,6. Flow,"Cat is a solitary animal, but as its home is devastated by a great flood, he finds refuge on a boat populated by various species, and will have to team up with them despite their differences.",Fantansy
6,7. Moana 2,"After receiving an unexpected call from her wayfinding ancestors, Moana must journey to the far seas of Oceania and into dangerous, long-lost waters for an adventure unlike anything she's ever faced.",Fantansy
7,8. Megalopolis,"The city of New Rome faces the duel between Cesar Catilina, a brilliant artist in favor of an Utopian future, and the greedy mayor Franklyn Cicero. Between them is Julia Cicero, with her loyalty divided between her father and her beloved.",Fantansy
8,9. Beetlejuice Beetlejuice,"After a family tragedy, three generations of the Deetz family return home to Winter River. Still haunted by Beetlejuice, Lydia's life is turned upside down when her teenage daughter, Astrid, accidentally opens the portal to the Afterlife.",Fantansy
9,10. The Sand Castle,A family of four is stuck on an idyllic island that hides a shocking reality.,Fantansy
10,11. Red One,"After Santa Claus is kidnapped, the North Pole's Head of Security must team up with a notorious hacker in a globe-trotting, action-packed mission to save Christmas.",Fantansy
11,12. The Lord of the Rings: The War of the Rohirrim,"A sudden attack by Wulf, a clever and traitorous lord of Rohan seeking vengeance for the death of his father, forces Helm Hammerhand, the King of Rohan, and his people to make a daring last stand in the ancient stronghold of the Hornburg.",Fantansy
12,13. Inside Out 2,"A sequel that features Riley entering puberty and experiencing brand new, more complex emotions as a result. As Riley tries to adapt to her teenage years, her old emotions try to adapt to the possibility of being replaced.",Fantansy
13,14. Parthenope,Partenope is a woman who bears the name of her city. Is she a siren or a myth?,Fantansy
14,15. Transformers One,"The untold origin story of Optimus Prime and Megatron, better known as sworn enemies, but who once were friends bonded like brothers who changed the fate of Cybertron forever.",Fantansy
15,16. IF,A young girl who goes through a difficult experience begins to see everyone's imaginary friends who have been left behind as their real-life friends have grown up.,Fantansy
16,17. The Watchers,"A young artist gets stranded in an extensive, immaculate forest in western Ireland, where, after finding shelter, she becomes trapped alongside three strangers, stalked by mysterious creatures each night.",Fantansy
17,18. Godzilla x Kong: The New Empire,"Two ancient titans, Godzilla and Kong, clash in an epic battle as humans unravel their intertwined origins and connection to Skull Island's mysteries.",Fantansy
18,19. The Crow,"Soulmates Eric and Shelly are brutally murdered. Given a chance to save the love of his life, Eric must sacrifice himself and traverse the worlds of the living and the dead, seeking revenge.",Fantansy
19,20. Ghostbusters: Frozen Empire,"When the discovery of an ancient artifact unleashes an evil force, Ghostbusters new and old must join forces to protect their home and save the world from a second ice age.",Fantansy
20,21. Solo Leveling: ReAwakening,"Over a decade after 'gates' connecting worlds appeared, awakening 'hunters' with superpowers, weakest hunter Sung Jinwoo encounters a double dungeon and accepts a mysterious quest, becoming the only one able to level up, changing his fate.",Fantansy
21,22. Damsel,"A dutiful damsel agrees to marry a handsome prince, only to find the royal family has recruited her as a sacrifice to repay an ancient debt.",Fantansy
22,23. The Life of Chuck,"A life-affirming, genre-bending story based on Stephen King's novella about three chapters in the life of an ordinary man named Charles Krantz.",Fantansy
23,24. Kung Fu Panda 4,"After Po is tapped to become the Spiritual Leader of the Valley of Peace, he needs to find and train a new Dragon Warrior, while a wicked sorceress plans to re-summon all the master villains whom Po has vanquished to the spirit realm.",Fantansy
24,25. Uglies,A world in which a compulsory operation wipes out physical differences and makes everyone pretty.,Fantansy
25,26. The End,"After decades alone, a wealthy family living in a salt mine encounters a stranger.",Fantansy
26,27. Spellbound,"Ellian is a tenacious princess who must go on a daring quest to save her family and kingdom after a mysterious spell transforms her parents, the King and Queen of Lumbria, into monsters.",Fantansy
27,28. Monster Summer,"When a mysterious force begins to disrupt their big summer fun, Noah and his friends team up with a retired police detective to embark on a monstrous adventure to save their island.",Fantansy
28,29. The Garfield Movie,"After Garfield's unexpected reunion with his long-lost father, ragged alley cat Vic, he and his canine friend Odie are forced from their perfectly pampered lives to join Vic on a risky heist.",Fantansy
29,30. Kalki 2898 AD,The future of those in the dystopian city of Kasi is altered when the destined arrival of Lord Vishnu's final avatar launches a war against darkness.,Fantansy
30,31. Harold and the Purple Crayon,"Inside of his book, adventurous Harold can make anything come to life simply by drawing it. After he grows up and draws himself off the book's pages and into the physical world, Harold finds he has a lot to learn about real life.",Fantansy
31,32. Descendants: The Rise of Red,"After the Queen of Hearts incites a coup in Auradon, her rebellious daughter, Red, and Cinderella's perfectionist daughter, Chloe, must team up and travel in time to undo the traumatic event that drove a young Queen of Hearts to villainy.",Fantansy
32,33. Girl Haunts Boy,"Follows Bea, a teenager ghost who forms a special friendship with Cole, the new guy in town, whose house she has been inhabiting for over 100 years.",Fantansy
33,34. Dear Santa,"When a young boy mails his Christmas wish list to Santa with one crucial spelling error, a devilish Jack Black arrives to wreak havoc on the holidays.",Fantansy
34,35. Rebel Moon - Part Two: The Scargiver,"Kora and surviving warriors prepare to defend Veldt, their new home, alongside its people against the Realm. The warriors face their pasts, revealing their motivations before the Realm's forces arrive to crush the growing rebellion.",Fantansy
35,36. Thangalaan,"Based on the true events that revolve around the lives of mine workers in the Kolar Gold Fields, Karnataka.",Fantansy
36,37. The Thundermans Return,"It centers on the family as they begin a new era of superhero crimefighting. When one save goes wrong, the Thundermans are sent back to Hiddenville.",Fantansy
37,38. Family Pack,"When night falls, and the players have their eyes closed, werewolves make victims among the villagers.",Fantansy
38,39. The Tearsmith,Sometimes our greatest fear is accepting that someone can honestly love us for who we are. Nica and Rigel are ready to find it out together.,Fantansy
39,40. Hot Frosty,"Widow Kathy magically brings a snowman to life. His innocence helps her heal and find love again. They bond before the holidays, but he's doomed to melt.",Fantansy
40,41. Irish Wish,"When the love of Maddie's life gets engaged to her best friend, she puts her feelings aside to be a bridesmaid at their wedding in Ireland.",Fantansy
41,42. The Best Christmas Pageant Ever,Nobody is ready for the mayhem and surprises that ensue when six of the worst youngsters disrupt the town's yearly Christmas performance.,Fantansy
42,43. Pedro Páramo,"Follows a dusty road to a town of death. Time shifts from one consciousness to another in a hypnotic flow of dreams, desires and memories, a world of ghosts dominated by the figure of Pedro Páramo, lover, overlord, murderer.",Fantansy
43,44. This Is Me... Now,This narrative-driven odyssey that coincides with the release of her same-named album tells the story of Jennifer Lopez's journey to love through her own eyes.,Fantansy
44,45. Orion and the Dark,"A boy with an active imagination faces his fears on an unforgettable journey through the night with his new friend: a giant, smiling creature named Dark.",Fantansy
45,46. That Christmas,"It's an unforgettable Christmas for the townsfolk of Wellington-on-Sea when the worst snowstorm in history alters everyone's plans, including Santa's.",Fantansy
46,47. Justice League: Crisis on Infinite Earths - Part One,"The Anti-Monitor, the Monitor's evil counterpart, is released into the DC Multiverse and begins to destroy the different Earths that compose it. The Monitor attempts to recruit heroes from across the Multiverse to fight back.",Fantansy
47,48. A Dog's Will 2,"After 20 years missing, João Grilo returns to Taperoá to join his old friend Chicó and, after his story of resurrection spreads, he is disputed as an electoral candidate by the two most powerful politicians in the city.",Fantansy
48,49. The American Society of Magical Negroes,A young man is recruited into a secret society of magical black people who dedicate their lives to a cause of utmost importance: making white people's lives easier.,Fantansy
49,50. Dragonkeeper,"The fate of ancient China rests on the shoulders of one young girl, who must find the last remaining dragon egg and fulfill her destiny.",Fantansy
50,51. The Wonderful Story of Henry Sugar and Three More,Four tales unfold in writer-director Wes Anderson's anthology of short films adapted from Roald Dahl's beloved stories.,Fantansy
51,52. Barroz: Guardian of Treasures,"For 400 years, Barroz, a loyal servant, has guarded da Gama's treasure. Bound by a centuries-old magic, he awaits the arrival of a true descendant worthy of claiming it.",Fantansy
52,53. Justice League: Crisis on Infinite Earths - Part Three,"Trapped in a pocket universe, surviving Earths face annihilation by the Anti-Monitor. Time shatters, bringing past heroes to aid Justice League against the epitome of evil. Their sacrifice may lead to victory.",Fantansy
53,54. Dan Da Dan: First Encounter,Momo Ayase is a school girl who meets her classmate Ken Takakura (named after the actor). Their unlikely friendship will face them against ghosts and aliens in a series of dark and funny adventures.,Fantansy
54,55. Buffalo Kids,"Two Irish orphans journey by train across America, encountering villains and heroes. They make an extraordinary friend and search for a new home, facing adventures and dangers along the way.",Fantansy
55,56. Thelma the Unicorn,"When a rare pink and glitter-filled moment of fate makes Thelma the Pony's wish of being a unicorn come true, she rises to instant international pop-superstar stardom, but at an unexpected cost.",Fantansy
56,57. The Balconettes,Three women in a Marseille apartment gets stuck in a heat wave. They find themselves trapped in a terrifying affair and longing for freedom.,Fantansy
57,58. Hanu Man,An imaginary place called Anjanadri where the protagonist gets the powers of Hanuman and fights for Anjanadri.,Fantansy
58,59. 10 Lives,"A pampered cat takes for granted the lucky hand he has been dealt after he is rescued and loved by Rose, a kind-hearted and passionate student. When he loses his ninth life, fate steps in to set him on a transformative journey.",Fantansy
59,60. Saving Bikini Bottom: The Sandy Cheeks Movie,"When Bikini Bottom is suddenly scooped out of the ocean, Sandy Cheeks and SpongeBob journey to Sandy's home state of Texas, where they meet Sandy's family and must save Bikini Bottom from the hands of an evil CEO.",Fantansy
60,61. Timestalker,The hapless heroine Agnes reincarnated every time she makes the same mistake: falling in love with the wrong man.,Fantansy
61,62. Woody Woodpecker Goes to Camp,"Woody Woodpecker must find a new home after being kicked out of the forest. At Camp Woo Hoo, he thinks he's found a forever home, but there's an inspector on the loose who wants to shut down the camp.",Fantansy
62,63. Justice League: Crisis on Infinite Earths - Part Two,The Anti-Monitor (the Monitor's evil counterpart) is released into the DC Multiverse and begins to destroy the different Earths that compose it. The Monitor attempts to recruit heroes from across the Multiverse to fight back.,Fantansy
63,64. Ultraman: Rising,"Ken Sato is a superstar baseball player who returns to Japan to become the latest hero to carry the mantle of Ultraman. However, he is compelled to raise a newborn kaiju monster, the offspring of his greatest enemy, as his own child.",Fantansy
64,65. Angels Fallen: Warriors of Peace,"When an Iraq War veteran receives a calling from a higher power, he embarks on a mission to stop a fallen angel from raising an army of the dead to take over the world.",Fantansy
65,66. The Tiger's Apprentice,"Tom Lee, a Chinese-American boy, after the death of his grandmother, has to be apprenticed to the talking tiger Mr. Hu and learn ancient magic to become the new guardian of an ancient phoenix.",Fantansy
66,67. Witch,"Small town, England. 1575. William embarks on a journey to prove the innocence of his wife, Twyla, falsely accused of being a witch and will be put to death if found guilty. William must hunt down the real witch, to save Twyla from death.",Fantansy
67,68. Kanguva,A tribal warrior's fierce struggle to save his people a millennium ago is mysteriously linked to a shadow cop's perilous quest in the present.,Fantansy
68,69. 200% Wolf,"When Freddy Lupin's wayward wish transforms him into a werewolf and deposits a mischievous moon sprite on earth, Freddy must restore the cosmic order before the earth and moon collide.",Fantansy
69,70. The Magician's Raincoat,"Three kids discover a magical raincoat that transports them into the body of its owner, a cursed magician. With a scorned witch hot on their trail, they must solve the mystery of the raincoat and break its curse before it's too late.",Fantansy
70,71. The Witch: Revenge,"In the aftermath of the Russian invasion of Ukraine in February 2022, a witch from Konotop seeks revenge on the Russian soldiers who killed her fiancé.",Fantansy
71,72. Overlord: The Sacred Kingdom,"Momonga, now known as the Sorcerer King Ains Ooal Gown, rallies the Sorcerer Kingdom and its undead army to join the fight alongside the Sacred Kingdom and the Slane Theocracy in hopes to defeat the Demon Emperor Jaldabaoth.",Fantansy
72,73. Cinderella's Revenge,"Cinderella is pushed too far by her evil stepsisters and stepmother, which causes her to switch out her glass shoes and use the assistance of her Fairy Godmother to seek bloody vengeance.",Fantansy
73,74. Doraemon the Movie: Nobita's Earth Symphony,"Doraemon and friends go on an adventure to meet new buddies, connect to people with music, and save the world from a crisis.",Fantansy
74,75. Cinderella's Curse,"Based on the same folktale that Disney updated and popularized for children, back in the 1950s.",Fantansy
75,76. Mars,"A zany crew of misfits blasts off to Mars, only to find they've been duped by a scheming billionaire. Chaos ensues as they face bizarre challenges and unexpected surprises on their wacky interplanetary journey.",Fantansy
76,77. Snatched a Billionaire to be My Husband,"Cora, once a billionaire heiress, is now bankrupt. As she struggles to support her ill mother, a cold-hearted billionaire falls for her, giving Cora a chance at reclaiming her life. They find true love, proving it transcends wealth.",Fantansy
77,78. Panda Bear in Africa,"A panda travels from China to Africa, facing hippos, hyenas, gorillas. He rescues his kidnapped dragon friend, makes new friends, and protects their jungle home.",Fantansy
78,79. Alienoid: The Return to the Future,Ancient Taoists travel through time and space in an effort to obtain a divine sword.,Fantansy
79,80. The Opera!,Modern version of Orpheus and Eurydice.,Fantansy
80,81. Chantal in Fairyland,"Chantal will be involuntarily transported to a fairy tale world, fighting against witches and tyrant kings, but above all for her friendship with Zeynep.",Fantansy
81,82. Mononoke the Movie: The Phantom in the Rain,"A deadly and mysterious master of the occult travels across feudal Japan, seeking malevolent spirits called Mononoke to slay. He must uncover their Form, Truth, and Reason to wield the mighty Exorcism Sword against them.",Fantansy
82,83. Demon Slayer: Kimetsu No Yaiba - To the Hashira Training,"Tanjiro undergoes rigorous training with the Stone Hashira, Himejima, in his quest to become a Hashira. Meanwhile, Muzan continues to search for Nezuko and Ubuyashiki.",Fantansy
83,84. Man and Witch: The Dance of a Thousand Steps,"A goatherd seeks help from a witch to break a curse that prevents him from taking a wife, so she sets upon him a series of impossible tasks.",Fantansy
84,85. Once Upon a Christmas Wish,"Mayor Brian Ortega is beloved in the idyllic community of Long Grove. While decorating for Christmas with the residents, Brian discovers his childhood Christmas wish list which magically begins to come true.",Fantansy
85,86. Harry Potter and the Stone,"Harry Potter, an eleven-year-old orphan, discovers that he is a wizard and is invited to study at Hogwarts. Even as he escapes a dreary life and enters a world of magic, he finds trouble awaiting him.",Fantansy
86,87. Cells at Work!,"Each and every body is a legion of cells, all performing their function to keep their owner operating.",Fantansy
87,88. Robin and the Hoods,"For the tenacious 11-year-old Robin and her loyal band of friends 'The Hoods', the patch of overgrown scrubland at the end of their cul-de-sac is a magical kingdom.",Fantansy
88,89. Devil's Knight,"In the realm of Veroka, an elite group of global monster hunters is summoned by King Samuel to vanquish the ancient Bone Devil, whose reign of terror threatens the Kingdom of Remény.",Fantansy
89,90. The Casagrandes Movie,"After a surprise family trip to Mexico derails Ronnie Anne's birthday plans, she is determined to prove she's old enough to do her own thing - even if it means confronting an ancient preteen demigod whose angst has apocalyptic potential.",Fantansy
90,91. Hagen,"A reinterpretation of the Nibelungen saga centering on Hagen von Tronje, a Viking who allies himself with the ancient gods and takes up arms against an unscrupulous ruler.",Fantansy
91,92. The Night Before Christmas in Wonderland,"The Queen of Hearts has outlawed Christmas. As a child, the white rabbit missed her gift. Years later, Father Christmas receives the lost letter and voyages to Wonderland. With the help of curious young Alice, can Christmas be saved?",Fantansy
92,93. Oshi no Ko: The Final Act,"Goro is a gynecologist and idol fan who's in shock after his favorite star, Ai, announces an impromptu hiatus. Little does Goro realize that he's about to forge a bond with her that defies all common sense!. Lies are an idol's weapon!.",Fantansy
93,94. The Invisibles,"A couple facing the end of marriage, when the husband starts to disappear. As he fades from existence he discovers a new world of people who have disappeared just like him.",Fantansy
94,95. Seven Cemeteries,A recent parolee (Danny Trejo) gets a Mexican witch to resurrect his old posse so that they can help him save a woman's ranch from a ruthless drug lord.,Fantansy
95,96. My Oni Girl,A high school student's life takes an unexpected turn when he meets an oni (demon) girl on a quest in the human world.,Fantansy
96,97. School of Magical Animals 3,"Children with magical animal companions at Winterstein School experience adventures spanning a forest and fashion show, encountering a snobbish cat and vegan crocodile while navigating friendship and first love.",Fantansy
97,98. Woodwalkers,"Carag, a shapeshifting puma raised in the wild, joins Clearwater High, a school for Woodwalkers. With friends Holly (squirrel) and Brandon (bison), he navigates mysteries and dangers of the Woodwalker world.",Fantansy
98,99. Balestra,"A competitive fencer agrees to test an experimental device that lets her train within lucid dreams in which she meets a mysterious stranger who will upend her marriage, her psyche, and her path to Olympic gold.",Fantansy
99,100. The Goat,"Forced to marry one of the elders in her Egyptian village, 12-year-old Hadiya escapes, traversing across the desert in search of her father, with her family goat, who soon begins talking to her with the voice of her late mother.",Fantansy
100,101. Big City Greens the Movie: Spacecation,"After ruining his family's vacation before it can even begin, Cricket attempts to right his wrongs by volunteering his family for an experimental farming mission - in space.",Fantansy
101,102. Dongeng Sang Kancil,"A mouse-deer, Sang Kancil, small in figure but cunning and wise. With his intelligence, Sang Kancil often escapes dangers and sometimes helps other animals that are in trouble with bigger and more fierce animals.",Fantansy
102,103. Ghost Cat Anzu,"Friendship shared between Karin, a strong-minded girl sent to live with her monk granddad in the Japanese countryside, and Anzu, the even-more unpredictable phantom feline who acts as her guardian.",Fantansy
103,104. The Yin Yang Master Zero,"During the Heian period, Seimei Abe trains in magic but lacks interest, until a collaboration with Hiromasa Minamoto arises to solve a strange phenomenon.",Fantansy
104,105. The Sleeping Woman,"Ana, a nursing assistant, begins to feel attracted to Agustín, the husband of a woman in a coma whom she cares for. She then begins to be harassed by strange phenomena who want to throw her out of the house and separate her from Agustín.",Fantansy
105,106. Ryan's World the Movie: Titan Universe Adventure,"Ryan's twin sisters Emma and Kate get trapped in a comic book world. Ryan enters this realm to rescue them, facing adventures, battles, and mishaps while attempting to bring them back before his parents discover their disappearance.",Fantansy
106,107. Enchanting Christmas,"A father's ice sculpture of a princess magically comes to life, causing unexpected disruptions in the lives of those she meets.",Fantansy
107,108. SuperKlaus,"Santa Claus' wish comes true when he accidentally bumps his head and starts believing he's SuperKlaus. With the help of Billie and Leo his elf-xecutive assistant, SuperKlaus will take on a toy-obsessed businessman to save Christmas.",Fantansy
108,109. Rita,"Rita, a 13-year-old girl, runs away from her abusive father to the big city. She finds solace until she's placed in a safe house run by the State. Rita and her cellmates plot an escape that ends in a shocking act of violence.",Fantansy
109,110. The Vord,"An ancient Nordic entity recruits a corrupt priest to deliver a woman's soul as a gift. Caught between her pagan roots and the church, she must resist those she once trusted as a spirit guide struggles to redeem them.",Fantansy
110,111. Orang Ikan,"Set in the Pacific, 1942. A Japanese soldier and a British prisoner of war are stranded on a deserted island, hunted by a deadly creature. Two mortal enemies must come together to survive the unknown.",Fantansy
111,112. Tim Travers & the Time Travelers Paradox,What happens if you travel back in time and eliminate your younger self? Terminally bored mad genius Tim Travers seeks to find the answer and unravel the time traveler's paradox. The Result? A crazy comedic adventure beyond comprehension.,Fantansy
112,113. Assassin's Guild,"After the Mermaid Wars, Iliad's city is attacked by dark forces. With the city full of rancor and corruption, Death herself forms an alliance and offers Atticus, an elite fighter, the chance to return to life. This gift comes at a price.",Fantansy
113,114. My Redneck Neighbor: Chapter 2 - Let the Games Begin,"Crazy Asians and Redneck clans escalate their Pranks to a point of no return when Cat tries to boil Reddick's Pet Gerbil, in retaliation, the Reddicks roast Cat's chicken for lunch, lead to an all out War,Winner takes all Redneck Games",Fantansy
114,115. Else,"A romance blossoms between an introvert and a confident woman, but their relationship faces a threat when a strange epidemic causes the infected to merge with their surroundings, trapping the couple in a shapeshifting nightmare.",Fantansy
115,116. Empire Queen: The Golden Age of Magic,"In a kingdom where magic is forbidden, a charming trio of adventurers embark on a dangerous quest in search of the legendary Sovereign Wand, which is needed to overthrow an evil queen and restore magic for all.",Fantansy
116,117. Sketch,"Still reeling from the unexpected loss of his wife, a single dad (Hale) navigates uncharted territory when his daughter's comically dark, scribbled drawings begin to come to life and wreak havoc on their small town.",Fantansy
