,name,story,genre
216,217. Fushigi Dagashiya Zenitendo,"The year is 1799 Romania. The Gypsy people on the verge of having their lands taken over by bloodthirsty rulers known as ""The Order"" An officer of the Order ""Captain"" finds his way into a twist of fate and his bloodthirsty companions.",Fantansy
217,218. Maya Puthagam,"In 2024's big Norwegian Christmas film, Cinderella turns fairyland on its head when she refuses to marry a lame prince just because the shoe happens to fit.",Fantansy
218,219. Maxxie LaWow: Drag Super-shero,"On the eve of the Apocalypse, a motley group of strangers plays Russian Roulette with a man claiming to be the Devil for a chance to save the world.",Fantansy
219,220. Una ballena,Ghanaian fisherman teams up with talking fish and companions for adventure to Accra. They chase dream of owning boat while balancing modern world and traditions.,Fantansy
220,221. Don Dukun,"In the world of Achilles Curse, a curse causes humans to live healthy incredibly long lives. However, they have one soft spot in their bodies that can bring them death. A detective with a secret ability to see other Achilles' curse attends an exclusive birthday celebration day at Laurent Museum that presents a legendary treasure showcase. The event quickly takes a turn after a group of thieves rob the treasure, leading to a murder mystery. He must solve the case with an adorable scammer.",Fantansy
221,222. Gypsy Moon,"An AI-driven, cutting-edge therapy revolutionizes depression treatment for women. Alesia's subconscious embarks on a virtual journey where reality and fantasy intertwine, forcing her to confront past demons to reclaim her mental health.",Fantansy
222,223. Askepote,"After a man-made disaster decimates an evergreen island, a stranded 11-year-old girl must find the tenacity to leave behind her home with the help of an unlikely friend.",Fantansy
223,224. Spin the Wheel,"Three years ago, On August 31st, A gigantic spaceship called the Mothership suddenly attacked Tokyo, and it seemed like the world was coming to an end. After that, the hopeless situation gradually became part of everyday life, and the strange sight of a mothership floating in the sky became commonplace. Meanwhile, high school girls Kadode Koyama and Oran Nakagawa, also known as ""Ontan,"" are living a casual student life with her homeroom teacher, Watarase, and her close friends.",Fantansy
224,225. The Fisherman,A frontier-era gang of misfits band together to battle an ancient and evil bloodthirsty hellbeast of Native folklore in this retro homage to classic 80's creature features.,Fantansy
225,226. Achilles Curse and the Curse of Treasure,"America 1994 -Somewhere Near Wichita, Kansas.",Fantansy
226,227. The Secret of Pin-Up Island,"A Nine Year Old Girl Goes Missing From Her Home, She Crosses Paths With The Cops, Criminals And The Mystics While Trying To Save Her Animal Friend.",Fantansy
227,228. Two Breaths,"""Anime galleggianti"" is a magical journey through the atemporal land of Sardinia inspired by Ovid's ""Metamorphoses"", mixing classical mythology with contemporary themes, literary tradition with local rituals, and documentary methods with fantasy.",Fantansy
228,229. Dead Dead Demon's Dededede Destruction Zenpen,I have been Cursed. How did this happen? I am still me but in this new body. I want to live but my time will run out. I have Just 6 weeks and I must travel to a new body. But to do this I must kill another.,Fantansy
229,230. Bloodspawn,"Aki, Ryo, and Yuta, childhood friends who grew up on the same island, are 20 years old and start living together in Takadanobaba, Tokyo. Even though their living environments are different: they work part-time at a bar, work as salespeople at a real estate company, and are students at a vocational school for clothing designers, the three are always connected in their hearts. The reason is, the mysterious creatures brought from the island, Touch, have mysterious powers similar to telepathy that connect them with different hobbies and personalities. The friendship between the three should continue, but they discover another hidden power of touch..",Fantansy
230,231. Space Dogg,"The six months of darkness finally arrived to Bogotá and the rest of the world, and with them the promises of anarchy and terror of the so called ""Hunters"". Ana a little 12 year old girl must escape from the city with her parents to protect their lives; locked up inside a bunker, Ana, Mateo and Angela will await underground hoping to avoid the horrors of the surface. Meanwhile, without the benefit of a refuge, John, a 35 year old man, will have to run with his wife, Laura, in order to protect the life of their unborn child.",Fantansy
231,232. Ella,"UmroAyyar: A New Beginning is a 2024 Pakistani sci-fi film, based on the classical Urdu-Persian novel, Hamzanama's character, Umro Ayyar, a thief and legend warrior of Tilism-e-Hoshruba.",Fantansy
232,233. Anime galleggianti,"When her wedding day turns to tragedy, a bride finds herself reliving the event again and again, hoping to set things right.",Fantansy
233,234. Soul Traveler (The Feature),"From the haunted forests of a lost Portuguese village, an evil energy is born - Humanity's only hope is a retired construction worker, a bottle of wine, a Zündapp 50cc motorcycle and a sword possessed by a strange demon.",Fantansy
234,235. Fureru,"After a thousand years of reincarnation, the demon king Bai Ze is about to awaken. Immortal Mu Qing was ordered to go to the demon world before the chaos in the three realms to find the demon king's magic weapon Qingluan Mirror to kill the demon king. By mistake, he embarked on a journey with the little demon Chaoyan. Get to know each other during adventure. Just when he was about to complete his mission, Mu Qing discovered that Chaoyan was the reincarnated demon king he wanted to kill. The two lives were related, but they were destined to be unable to escape the arrangement of fate.",Fantansy
235,"236. The Girl, the Hunter & the Firefly","Amidst French Revolution chaos, Princess Agnes seeks refuge in Bohemian castle. Doubt surrounds her royal identity until a pea beneath her mattress unveils the truth.",Fantansy
236,237. UmroAyyar - A New Beginning,"In a town plagued by serial murders, corpse stitcher Li Nian resurrects a hydra, Xiao Mei, by stitching a headless corpse. She manipulates Li Nian's affections, seducing him to merge their love, while framing his wife as a demon snake.",Fantansy
237,238. The Beads,"Chicago 1941. Meet private eye Richard Stone, celebrating at his Christmas Even office party after beating the draft by way of a bribe. He's a disappointment to his secretary and main squeeze, Katie Crocket, whose brother Ben is fighting overseas; and his honest young employee joey Ernest is guilt-ridden over all the divorce-racket keyhole peeping. Worst of all, his equally sleazy partner, Jake Marley, was murdered a year ago tonight and Stone didn't bother solving Jake's ho-ho homicide.",Fantansy
238,239. The Old Man and the Demon Sword,"A teenager with the ability to enter other people's dreams. When he witnesses a dark spirit taking people's lives in their dreams, he quickly realizes that it's related to the mysterious deaths that are happening in the real world.",Fantansy
239,240. The lord of the monsters,A nutty archaeology professor pokes his nose into the wrong Aztec artifact.,Fantansy
240,241. Princezna na hrásku,A circus-like dark comedy about a country of destruction.,Fantansy
241,242. Snake Skin Beauty,"Orphans, Varya and Arseniy move from their native village to the house of their adoptive parents. But hope for a happy life fades when they are challenged by an ancient otherworldly force.",Fantansy
242,243. Blue Christmas,"The story of 45-year-old journalist Nacer, who has been monitoring the emergence of bizarre yellow sandstorms in and around Algiers.",Fantansy
243,244. Respati,"A misfit horror-themed rock band relocates to rural Japan, determined to compose the ultimate punk anthem.",Fantansy
244,245. Deadlands - A Fly Story,"In a certain biological research institute in the Pacific, a breakthrough was made in the latest fish accelerated reproduction",Fantansy
245,246. The Eye of the Salamander,"In the heart of an ancient village in southern India, a place shrouded in mystery and legend. The temple is believed to hold secrets that date back centuries, connected to a powerful deity and a hidden treasure that could change the course of humanity. Suriya (Aadi Sai Kumar), an adventurous and fearless Police officer, embarks on a quest to uncover the secrets of the Shanmukha temple. Accompanied by his courageous Research Student Sara (Avika Gor), they delve into the depths of the Forest's hidden secret Place, guided by ancient scriptures and local folklore.",Fantansy
246,247. Hiçbir Sey Normal Degil,"A wild dark comedy that follows reclusive writer, Vincent Tremblay, who suddenly becomes the target of a mysterious and sinister force.",Fantansy
247,248. Domovoy,"Molly is a ten-year-old girl who believes that if she learns to play the fiddle like her dad and wins the All-Ireland Music championship, her father will wake from his coma.",Fantansy
248,249. Les tempêtes,"Laban is not like other ghosts. He is afraid of the dark. Laban loves nothing more than to be scary, but no matter how hard he tries, he only succeeds in scaring himself. Laban lives with his Mummy and Daddy Ghosts and his tough little sister Labolina in the basement of the Goodmorning Sun castle. Labolina can imitate all the sounds in the world. There are also some people living in the castle: the King and Queen, Princess Busan and Little Prince Bus, who are Laban's very best friends.",Fantansy
249,250. The Gesuidouz,"During the Covid-19 pandemic, four anxious strangers take a record-breaking dose of LSD, catapulting them into a shared psychedelic dream where they must find solace and redemption before they can return to the real world.",Fantansy
250,251. Megalodon Returns,"The film tells the story of Xiao Yan's struggle to rescue his friends and avenge his mother, and how he survives all the hardships, rises from the ashes, and returns with strength.",Fantansy
251,252. Shanmukha,"The story is based on the background of the arms artisans of Munger, which revolves around a character named Daya. A fictional character. Daya lives in a fictional village Called Barhad in Munger.",Fantansy
252,253. Vincent,"When a homeless little ghost knocks on the door to the eccentric residents of a Ghost Train on the lookout for a place to belong, she accidentally attracts the attention from the ""outsideworld"" and must team up with the motley crew of monsters on a crazy quest to save not only the future of the Ghost Train but also her only chance to finally have a family of her own.",Fantansy
253,254. Fidil Ghorm,"A boy comes across a rabbit, guardian of a magical brush to prevent the Yamata no Orochi from re-emerging in the modern world.",Fantansy
254,255. Lilla spöket Laban spökar igen,"A desperate king faces banishment after his three wives fail to birth a son. He takes a new wife from another world, who promises him an heir but only with conditions.",Fantansy
255,256. A Trip Elsewhere,"An LSD trip delves deep into the heart of India and the human soul, as a Westerner journeys through foreign land searching for the woman he loves who got lost down the Ganges. A psychedelic experimental/narrative experience.",Fantansy
256,257. Fights Break Sphere 3,"In order to avoid the resurrection of the demon, the immortal Bai Zihua led the immortal world to try to seal the demon again. He and his disciple, the orphan Hua Qiangu, develop a relationship, but face an even greater world crisis.",Fantansy
257,258. Avaidh,"Jo, a burgeoning screenwriter, steals dreams for inspiration, but are there consequences?",Fantansy
258,259. Elli and the Ghostly Ghost Train,Nameless character walks a mysterious through the city.,Fantansy
259,260. Nueva Tierra,"Sun and Moon is a fantasy story about conflicts between opposites. The story takes place in a fictional medieval kingdom named Ryhmin. Ryhmin is being tested by its surrounding wilderness, where the greater spirit Muinein controls the events of the story. Disagreement about the use of magic has divided the people of Ryhmin. Some see magic as an opportunity to better the world, others fear it will lead to Ryhmin's destruction. Is there a balance?",Fantansy
260,261. Tokusou Sentai Dekaranger 20th: Fireball Booster,"Nature Cat and his pals realize they've come to the end of their Nature Curiosity List. Meanwhile, Sir. Galahad gives himself the title of King and moves into a barren castle and steals pieces of nature to make his castle look more beautiful.",Fantansy
261,262. Pushpaka Vimanam,"The life of Rayenari, a Tarahumara native in northern Mexico, will suddenly change with the visit of a strange poet called Antonin Artaud.",Fantansy
262,263. Brush of the God,"Cheng Jialang and Wei Yifu are the contemporary poker twin stars, and they are about to have their first face-to-face confrontation. However, at this moment, Cheng Jialang accidentally transferred his poker talent to a small-time crook named Huang Xiaoqi, who had no previous experience. The two of them went through a wonderful journey and decided to join forces to challenge Wei Yifu.",Fantansy
263,264. Beast of Two Worlds,"The heroes will accomplish many feats: they will revive the unfortunate Koshchey, find the missing crown of the Prince, deal with the cruel khan - they can do everything. They can even cope with evil spirits. The horse Julius, the Serpent Gorynych and many others are always ready to come to the aid of the three heroes.",Fantansy
264,265. PinkCity: A Psychedelic Meditation,Anthology film featuring the early shorts of Monty Wolfe,Fantansy
265,266. The Journey of Flower,"Scientists investigating Borneo funeral totem vanish. Bi and Professor Sani search for them, uncovering the totem's sinister past involving human sacrifice as they probe the mysterious disappearance.",Fantansy
266,267. Dream Thief,"In this film, when all 4 of Shrek's old nemesis come back from the dead and kill Fiona, he must find a way to bring Fiona back from the dead via magical contract, all with the help of Donkey, Puss, and some new faces.",Fantansy
267,268. Apokrif,"Made up of three substantial yet uniquely identifiable Christmas tales, ADVENT sees numerous specific lives all caught up over the course of a magical December 24th.",Fantansy
268,269. Sun and Moon,A small boy's adventure in Wonderland as he searches for his father. A dark fantasy full of things that go bump in the night.,Fantansy
269,270. Nature Cat's Nature Movie Special Extraordinaire,"The brownie escapes from the captivity of Baba Yaga in her magical world, and ends up in the apartment of the girl Natasha and her parents. Kuzya needs to find his magic chest that grants wishes. Both Natasha and the local grumpy brownie Nafanya help him in this. It turns out that Kuzya himself gave the chest to Andrey, Natasha's dad, many years ago. It would seem that the goal is already close, but in search of both Kuzya and the chest, Baba Yaga entered our world, and she has her own insidious plans.",Fantansy
270,271. Jíkuri,"Qingdai, a royal umbrella's fairy, embarks on a journey with a young craftsman to prevent war after failing to guard a vengeful sword's fairy who escapes the royal pavilion.",Fantansy
271,272. Po ke wang zhe,"In 1980s New York city, high school student Jamie Fonseca is desperately in love with local bad boy Nick Nieves, but her mom doesn't approve and her best friend warns her of the ongoing danger of being involved with his kind. When Jamie decides to follow her heart instead of wise advice, it seems to mark the beginning of their love affair, but Jamie then becomes submerged with all the mess that comes with loving Nick. It soon becomes clear that this young romance is anything but ordinary. Jamie's bond with Nick gets tested with dangerous situations that comes his way. How long can this love last?",Fantansy
272,273. Tri bogatyrya. Ni dnya bez podviga,In a small town called adoption Island known for its low crime rate and very safe living but behind everything there was a monster and if you say his name three times pumpkin pumpkin pumpkin he will appear someone did it again it's up to Piper to figure out how to stop him he's more brutal this time.,Fantansy
273,274. Fragments of Us,"Ballet. At a party, Victorian teenager Alice (Francesca Hayward) receives a book from friend Lewis Carroll. Mother rejects Alice's growing love for gardener Jack (William Bracewell) Distraught, the girl dreams herself into Carroll's book.",Fantansy
274,275. Fatal Expedition,"A new adventure full of mystery with the Galactic Cat. Roni wins a magic watch and ends up in an enchanted village, where children are disappearing. With his friends, he will face the powerful Perpétuo and save Cronópolis",Fantansy
275,276. Shrek 5: The Contract - A Fan Made Film,"Based on a famous Bangladeshi ballad-opera, where portraits the backstory of a lady conqueror.",Fantansy
276,277. Advent,"Within Hong Kong's bustling cityscape, vignettes intertwine the lives of its inhabitants, bound by tea, cigarettes, and broken lighters, as they grapple with life's myriad facets, and themselves.",Fantansy
277,278. The Alpha Kings Wolfless Luna,"Dana goes in search of her father, a scientist who has invented a machine that can solve an important problem - the lack of drinking water. A real traveling circus will help her in her search.",Fantansy
278,279. Wonderland,"In a post-plague world, two nuns assist a woman accused of witchcraft. As they journey, each harbors personal demons and secrets, adding tension to their quest. Themes of faith, survival, and the consequences of fear are explored.",Fantansy
279,280. Domovyonok Kuzya,"A band's lead singer Jiang Siwang (Aaron Kwok) , leaves his daughter, Jiang Lu (Yingying Lan), unexpectedly after his fatal car accident. But he is reborn as a dog twenty years later. Now he gets to spend the time with his daughter that he couldn't when he was still a human in this tear-jerking family film.",Fantansy
280,281. The Umbrella Fairy,"Brothers, Ramses and Ahmos, cursed since the days of the Pharaohs, are the last two vampires in Egypt. After stumbling upon an ancient secret, they embark on a comedic journey of ""self-reflection"", brotherly love, and survival in the year 2023",Fantansy
281,282. Young Love,"It's the late 1980s in Cuba, and in an isolated ranch in a small town near Santa Clara, lives Vilma, a young nurse who dreams of a better place to raise her upcoming baby, along with her disabled husband Ivan. However, neither her skills as a nurse nor as a shooter will free Vilma from her harsh reality until a natural phenomena sweeps her away and Vilma wakes up in a place where it seems her dream will come true.",Fantansy
282,283. Adopt me All hallows Eve II,"Emers are superhumans endowed with unusual abilities. They can control human emotions and feel no pain. However, they are unable to truly love. One day, their world is under threat, and Denis, a young half-breed emer, goes in search of the chosen one who can save everyone.",Fantansy
283,284. RB&O Live: Alice's Adventures in Wonderland,"Kaka is the son of a hero. His body is invaded by an evil force which grows stronger as he grows older. Eventually this force will have enough dark power to destroy the entire world. To prevent such a catastrophe from happening, the legendary Black Dragon, Princess Nini, Chief Baragon and bratty Bearly team up with Kaka to defend their homeland. They venture through forbidden lands, an underground world and a parallel universe, fighting off carnivorous flowers and stone creatures along the way. Despite the risks, the youngsters show no fear. They are determined to banish dark forces from their land.",Fantansy
284,285. Gato Galactico e o Feitiço do Tempo,"A spooky comedy about a couple who venture to a cabin in the woods to find a page torn from an evil book. Once they arrive, things get weird. They must unfold the mystery, defeat the occultist, his talking pumpkin, and a malevolent spirit.",Fantansy
285,286. Kajolrekha,"The protagonist, Sasanami Unmei, transfers to Nagumohara Junior High School in Nagasaki in search of a soccer-free environment, wishing that soccer would disappear. Meanwhile, Endou Haru, who has demonstrated his natural talent and reigns at the top of his generation, also has complicated feelings about soccer. The unexpected encounter between these two opens the door to new heroes.",Fantansy
286,"287. Fallen Leaves, Broken Lighters",Ulisses visits a vocational coach and ends up leaving the clinic with the power to discover people's true vocation with just one touch.,Fantansy
287,288. Formula vody,"Yucha from a village threatened by typhoons in 1958 ventures into the mountains, confronting the grieving spirit Oyo, whose sorrow has caused catastrophic floods for centuries, returning a sacred water-filled bowl to Oyo's drowning spot.",Fantansy
288,289. Witches of God,"Fear Forest was once a wildly successful amusement park run by the mysterious Mr. Malichi Bones and highlighted by a group of frightening animatronic classic monsters. Now in ruins and nearly ready to be sold off, the park is being cleaned out by a group of inmates on a work release program. But their nightmares are just beginning, as the true horrors of this abandoned place emerge in frightening fashion.",Fantansy
289,290. 10/31 Part 4,"Since ancient times, the magical inhabitants of the seas have been under the protection of fairies who use the mystical Dance of the Wind to scare away evil. Over the years, magic began to fade, and magical creatures began to disappear. Now, the last of its kind in China can only be saved by a young fairy named Lin, who must find someone to share the Wind Dance with and hide a unique creature from poachers.",Fantansy
290,291. Woof Woof Daddy,"The Gods, the Guardians of Time, tired of the outrages of Father Frost, sentence him to exile on Earth, but on Earth he has a new granddaughter - Vasilisa, who for some reason melts under the sun. The famous blogger Dasha is hunting for her granddaughter, who wants to destroy the world with Vasilisa's magical powers.",Fantansy
291,292. Dracu Ra,Friends on a psychedelic camping trip are confronted by a mysterious cosmic being. They're thrust into a nightmarish battle for survival through fear and paranoia all while fighting to escape the horrors of the forest and their own minds.,Fantansy
292,293. Fenómenos naturales,A cockroach-man Mute faces a dastardly puppeteer and saves his tone-deaf city with beer.,Fantansy
293,294. Samaya bolshaya luna,"The troubadour and his impostor friends - a Dog, a Cat, a Donkey and a narcissistic Rooster - teamed up to accomplish the feat. The wandering musicians, led by a new leader, will rally again to bring laughter and joy back to the gloomy streets of Bremen. First of all, they must make the King's daughter laugh, but meeting the Princess threatens a dangerous adventure. There are insidious enemies, intrigues and traps against the Troubadour and his friends, but you have to fight for love. And then the Princess ran away from the palace. In one tangle there are criminal schemes of Robbers, intrigues of a Detective, whims and secrets of the royal family, but cheerful musicians with an indefatigable Troubadour will make everyone dance to their tune. What are the Bremen Town musicians willing to do for the sake of the feat?",Fantansy
294,295. Black Dragon,"On the day he plans to leave Nigeria for a new life abroad, Mezu discovers he's trapped in a time loop. His colleague Kamsi is in the same predicament. Together with their friends Tobe, Wasiu, and Sola, they must unite to break free.",Fantansy
295,296. Bob a Bobek ve filmu: Na stope Mrkvojeda,"A wish turns a tree into a love story, battling against destruction to protect nature's heart.",Fantansy
296,297. Couple in the Woods,"Zhanna is an unusual housewife; she can read minds, move objects and influence people's minds. But she uses her superpower exclusively for personal purposes. One day she falls into the hands of the intelligence services and becomes a special intelligence agent. While carrying out one of her missions to clean up the top of organized crime, Zhanna is captured. There she has the opportunity to lead a squad of teenagers with very unusual superpowers and turn them into real superheroes.",Fantansy
297,298. Jack Hardy's Guide to Blackjack,"The Snow Queen and Santa Claus were once old friends who learned the magic of cold together. But their paths parted when the Snow Queen, envious of her friend's strength, stole a magical artifact from which Santa Claus drew his power and created magic. The wizard was able to defeat the sorceress with some difficulty and imprisoned her in an ice prison. Thousands of years later, nowadays, the boy Yura finds the ice staff of the Snow Queen at the New Year's fair and unwittingly frees her. Returning to the modern world, she decides to take revenge on her sworn friend and comes up with an insidious plan that will freeze the whole world on New Year's Eve. For this purpose, she kidnaps a boy and takes him to the ice kingdom. To prevent her machinations and save not only Yura, but also the whole world, Santa Claus will need the help of the sorceress Baba Yaga, Ivan Tsarevich, Maria the artificer and other magical creatures. A new, incredible adventure awaits them.",Fantansy
298,299. Inazuma Eleven the Movie: Prologue to the New Heroes,"At the threshold of fantasy and magical realism, Barbara and Victoria explore two opposing worldviews. Navigating dreamlike landscapes, they seek to fulfill their dreams without fit into the mold.",Fantansy
