,name,story,genre
117,118. White Snake: Afloat,"Xiaobai finally found Xu Xian, the reincarnation of Axuan, after 500 years, the two met on the Broken Bridge. Xiaobai and sister hid in the streets and alleys, started a lively life in human world with him and his brother-in-law Li Gongfu.",Fantansy
118,119. Seven Seas Seven Hills,"Caught between family duty and romantic love, a young man faces an impossible choice.",Fantansy
119,120. The Lost Tiger,"Adopted by a wrestler kangaroo family, Teo's life changes when visions lead him to his roots. He embarks on an epic journey to save his homeland from destruction.",Fantansy
120,"121. Die Heinzels: Neue Mützen, Neue Mission","Elfie's world is turned upside down when she discovers the existence of a technically advanced Elfkin gang that, in stark contrast to Elfie's own clan, is second to none when it comes to fun and thrill-seeking. Can Helvi's friendship with Bo, the youngest gang member, reconcile the two Elfkin clans after more than 250 years? Based on the feature film ""The Elfkins - Baking a Difference"" and inspired by the famous German saga and poem by August Kopisch.",Fantansy
121,122. My Future You,"This is a magical story of 2 people, Lex and Karen, from different timelines - 13 years apart - connected by a mysterious comet through a dating app. As they grow close, Karen asks Lex to change key moments in her past to prevent her parents' separation. But every change of the past brings unforeseen consequences, altering their futures in unexpected ways. In one last effort, Lex hopes to set things right, but some events may be beyond control.",Fantansy
122,"123. Love, Danielle","Amid family drama and dysfunction, a woman who carries a BRCA gene mutation must decide whether or not to remove her breasts and ovaries to reduce her cancer risk.",Fantansy
123,124. Witch Hunter,"A medieval town plagued by demonic beasts, once innocent woodland creatures twisted by a powerful witch. A fearless hunter and his warriors must confront her dark magic to restore peace.",Fantansy
124,125. Princesa Adormecida,"Rosa's overprotective uncles shield her from a hidden truth. At fifteen, a mystery from the past emerges, endangering Rosa amidst a villain's vengeance, forcing her to confront the reality she believed was mere fantasy.",Fantansy
125,126. We Work for the Dead,If you're looking for a unique side hustle and don't mind being possessed...sign up for a delivery service with a dark twist. Your clients? The Dead.,Fantansy
126,127. The Ballad of Hortensia,A narcissistic comedian wakes up in the opposite sex body following an automobile accident.,Fantansy
127,128. River of Ghosts,"A psychiatry student returns to his hometown as a hypnotherapist. Treating townspeople's issues, he becomes popular but faces self-doubt until a challenging case arises, forcing him to confront his own demons for personal growth.",Fantansy
128,129. The Traveller,Based on the popular Chinese graphic novel The Outcast.,Fantansy
129,130. Niko: Beyond the Northern Lights,Niko is a flying reindeer boy whose biggest dream is to become a member of Santa's flying forces. But instead he loses Santa's sleigh and during pursuit to get it back he learns the importance of friendship and doing things your own way.,Fantansy
130,131. Schneewittchen,"Snow White declines the Prince's offer to witness the Evil Queen and the Hunter's intimate encounter, quipping she'd prefer to hear about it instead.",Fantansy
131,132. The Proud Princess,"Proud princess Krasomila lives isolated, her advisers scheme to marry her to a weakling; King Miroslav disguises as a gardener to cure her pride; they flee advisers' rage; she discovers his identity; they marry, advisers expelled.",Fantansy
132,133. Letters at Christmas,"Amidst renovation of an old hotel, a divorcing couple's marriage gets a chance when their kids find love letters from the past. Saving their parents' marriage before a developer buys the hotel becomes the siblings' mission.",Fantansy
133,134. The Seductress from Hell,A Hollywood actress undergoes a horrific transformation after being pushed to the edge by her psychopathic husband.,Fantansy
134,135. Planet 7693,"Luka, an imaginative nine year old boy tries to heal the disrupted family relations with the special help of his strange and mysterious friend 7693.",Fantansy
135,136. White Cobra Diamond Fox vs the Golden Eye,Tarjella and Diamond are on the search to obtain the magical ring. They come into an obstacle of situations with supernatural occurrences. Diamond Cobra vs The White Fox sequel.,Fantansy
136,137. The Sisters,"A series of unexplained missing cases and disturbing deaths start to occur in a faraway village when the Chief's dead daughter comes back to life, unveiling shocking secrets of the village's Forest Demon and the ritual of human sacrifice related to the prosperity of the Chief's family.",Fantansy
137,138. Hold Me Close,"Seven years after traveling worldwide, Woody lands in Japan, encountering Lynlyn, gifted to sense individuals' potential impact on her life through touch.",Fantansy
138,139. Bhairadevi,"At the heart of an imaginary world populated by fantastical creatures and dangerous monsters, the 13 year-old Zak goes in search of his twin brother Kyle, who has disappeared mysteriously. Equipped with a magical jade stone whose superpowers he doesn't yet know how to control, he is joined by his grandmother NaïNaï and Indiana, a beautiful outlaw who can communicate with the world's fantastical creatures. But he is also flanked by Wowo, formerly a 3 meter-tall furry pachyderm, now turned into a tiny, cute and wacky furball by the magical jade stone.",Fantansy
139,"140. Zak & Wowo, la légende de Lendarys","Three detectives follow the trail of a copycat serial killer to an abandoned insane asylum, only to find they've been lured there by something far more sinister.",Fantansy
140,141. Wicked Season,A a mythological mysterious film based on Indian mythology and Mayan tribes and their connection with the apocalypse of this world. Talks about the origins of human and their end.,Fantansy
141,142. Saint Young Men: Holy Men vs Demon Army,"Bakin Takizawa, a popular Edo period author, begins to recount a story he is planning in front of his friend, the artist Hokusai Katsushika. The story is about eight warriors who, each carrying a jewel, gather together as if guided by fate and embark on a harsh journey to fight the curse of the Satomi family. Hokusai is drawn to Bakin's story and visits Bakin on various occasions to hear the rest of the story, and a strange relationship between the two begins. However, as the story finally approaches its climax, Bakin begins to lose his sight. With the completion of the story in question, he receives an unexpected proposal from his daughter-in-law. Will the story ever be completed?",Fantansy
142,143. Mayan,"Follow a singer who dies suddenly while on tour in Japan, but her spirit lives on and she embarks on a journey to find humanity in the after-world.",Fantansy
143,144. Hakkenden,"In a fairy-tale kingdom, a soldier on his way home accidentally finds a magic flint and frees the little girl Dasha, who was kidnapped and bewitched by the evil Likhodey, who was locked in it. To dispel his spell, the soldier will have to go on a dangerous journey.",Fantansy
144,145. Spirit World,"Juki again experienced a problem that most people often experience. In the midst of the family's difficult financial conditions, Si Juki finds a treasure map left by his ancestors.",Fantansy
145,146. Ognivo,"Journey of Malaikottai Vaaliban, an undisputed warrior, transcends time and geographies, triumphing over every opponent he encounters.",Fantansy
146,147. Phallacies,"Adaptation of the classic fairy tale, the descendants of Niu Lang and Zhi Nv continue to write a new adventure.",Fantansy
147,148. Si Juki the Movie: Harta Pulau Monyet,Revolves around age-old practices such as black magic and witchcraft.,Fantansy
148,149. Malaikottai Vaaliban,A legal case unites two lawyers between rivalry and romance.,Fantansy
149,150. Into the Mortal World,"Follows Danny and Evie as they go through individual and romantic evolutions, while the moon and all it represents accompany them, also serving as a marker for the passage of time.",Fantansy
150,151. Pechi,"Shankar, an amnesiac Aghori who suffers from the fear of touch, goes on a dangerous Himalayan trail in search of a mythical cure for his condition. What happens when his past uncovers the way for him?",Fantansy
151,152. Perdiendo el Juicio,"After the mysterious death of her husband, a woman hires a reluctant spirit hunter to expel an evil spirit tormenting her family. Unknown to the spirit hunter, the family has a dark secret that they have sworn to keep hidden at all cost.",Fantansy
152,153. Witchy Ways,A father and daughter maintain their bond despite living in different countries through an imaginative nightly ritual where she suggests a title and he creates short animated films starring her as the hero.,Fantansy
153,154. Gaami,"In order to find her soulmate, Romi wandered deep into the jungle. There, she meets Heartsping, a Teenieping with passion. On the way, they face grave dangers. Will Romi and Heartsping's friendship move on?",Fantansy
154,155. A Song from the Dark,"Capitán Avispa, hero of Wasptropolis and the Honey Kingdom, puts to test his nobility, justice and innocence against the evil wasp Jacques Poison and his henchmen.",Fantansy
155,"156. Maya, donne-moi un titre","Madan, an archaeologist, uncovers a connection between a series of mysterious events and a myth about a shape-shifting serpent.",Fantansy
156,157. Heartsping : Teenieping of Love,"A group of guardians are tasked with protecting a messenger who must deliver vital information to their king. On their journey through an ancient land, they face a battle filled with plagues, dark magic and vile monsters.",Fantansy
157,158. Captain Avispa,"The life of a writer who discovers a deep connection to their past life. As they delve into their memories, they unravel a story of heartache, resilience, and the power of love that transcends time.",Fantansy
158,159. Naag Bhoomi,"Young Sebastian wishes his nanny was his mom, and his wish is granted when they accidentally switch bodies, leading to hilarious misadventures.",Fantansy
159,160. Warchief,"Self-centered Solomon Lynch takes a journey through his past, present, and future. But it takes more than Christmas spirit to set things right in this story of hope, faith, and redemption.",Fantansy
160,161. Aalan,"A man spends his days in hospital without too many worries. He has been hospitalized, safe from everything, without responsibilities and problems. That routine runs smoothly until a new person is admitted to the same ward.",Fantansy
161,162. Intercambiadas,"Aravind has been gifted with two angels in his life ever since his birth. However, his life dramatically changes forever when one of the angels commits an error that accidentally costs him his life, resulting in his untimely demise.",Fantansy
162,163. Carol,Something terrible happened to Jenny's friends and she must travel back in time to fix it.,Fantansy
163,164. Nonostante,"Son Goku and his friends must fight against Raditz, a space warrior who arrives planet Earth to conquer it and destroy human race.",Fantansy
164,165. Double Tuckerr,"A man, plagued by insomnia, turns to Doctor Sander's Sleep Cure tapes for relief, becoming the unwitting star of his own nightmarish productions, navigating through bizarre and morbid dreamscapes filled with macabre humor.",Fantansy
165,166. The Time Travel Hills,A bored office worker may have accidentally sparked a revolution in a bizarre dystopian world.,Fantansy
166,167. Dragon Ball Z Kai,"In a suburban town near Hanoi in the early 2000s, housewife Tam finds out that her husband is cheating on her. Instead of confronting him, she voodoos her husband back into love.",Fantansy
167,168. Dr. Sander's Sleep Cure,"When the monster Dopants, who use the power of the Gaia Memory, begin to operate in the windy city of Fuuto, the young Shotaro becomes an assistant to the detective Narumi Soukichi and spends his days chasing after him. Shotaro, who knows nothing about Soukichi, who secretly works as Kamen Rider Skull in addition to his detective work, becomes increasingly frustrated. One day, a new request comes into the Narumi Detective Agency, leading Shotaro and his team to a fateful night.",Fantansy
168,169. Schirkoa: In Lies We Trust,"On a volcanic isle, Nana stays while others leave. Her ill mother Nia left after Nana's birth. Sent to the volcano's base for fever treatment, Nana encounters a dream-reality world. Years later, teenager Nana reunites with returning Nia.",Fantansy
169,"170. Don't Cry, Butterfly","A pop singer gives up her career to become an actress, but she slowly goes insane when she starts being stalked by an obsessed fan and what seems to be a ghost of her past.",Fantansy
170,171. Fuuto PI: Portrait of Kamen Rider Skull,"Dalia, the daughter of a famous writer who recently passed away, inherits the mission of finishing her father's novel. To do so, she must become part of the story and face its characters, all fighting to be the protagonist of the book.",Fantansy
171,172. Hanami,"A warped modern fairytale plays out in a crumbling 'kingdom' populated only by a King and a Servant. The arrival of a mannequin Queen throws their carefully constructed world into isolation, madness, and murderous megalomania.",Fantansy
172,173. Perfect Blue,"The son of the museographer Raluca, the ""favorite"" of the guard Nea Bebe, Vlad, has a magical encounter: Alexandru Ioan Cuza is embodied in the immersive gallery of Romanian heroes and takes Vlad on a journey where the boy discovers Saint Andrew, Decebalus, Dragos, John Hunyadi, Vlad the Impaler, Stephen the Great, Michael the Brave, Constantin Brâncoveanu and Marie of Romania in key moments that marked their destiny.",Fantansy
173,174. Dalia y el Libro Rojo,A deceased woman gets a chance to reconnect with her past lover. They embark on a journey across time and continents to fulfill her wish of having her ashes scattered in Japan,Fantansy
174,175. King Baby,"As Liz struggles with nyctophobia (fear of the dark), an anxiety disorder that disrupts her sleep, she desperately tries to fall asleep.",Fantansy
175,176. Noaptea lui Vlad,"Goblins attack, capture king. Princess escapes with jester to his village, disguises as peasant. Stepmother usurps throne, issues reward for princess. Princess plans with friends to rescue father, restore peace.",Fantansy
176,177. Last Song for You,"Vid, a father grappling with the encroaching threat of a multicorporate iron ore mine near his home, discovers resilience and hope through his young son's imaginative perspective, blending optimism, fairy tales, and mysticism into their grim reality.",Fantansy
177,178. Nyctophobia,"The origin story of masked vigilante and immortal soul, Nemesis Knight.",Fantansy
178,179. Princess Halle and the Jester,"Following his return to a homeland ravaged by war, Cedric Vale offers his services as Knight-Protector to the Baron of Pres, only to learn shortly after that the Baron has married the woman he loves, Lady Alysia.",Fantansy
179,180. Sunce nikad vise,"Every 100 years a member of the Yayauqui family needs to sacrifice a human at the altar, to prevent the end of the world. It's Rita's turn and she doesn't believe it, however, she finds herself in the Vertical Zone on the mission.",Fantansy
180,181. The Phantom Warrior,"Slave Tyrol leads a quest to rescue Princess Meyra from evil wizard Akaris' fortress. Facing ancient creatures and tests, he must slay a dragon to save the princess and realm from darkness.",Fantansy
181,182. Cedric & Alysia,"When Monica, J-Five, Maggy, Smudge, and Milena discover that the Limoeiro Museum will be auctioned, they decide to come together to save it. While investigating what is happening, they come across secrets of the Limoeiro neighborhood.",Fantansy
182,183. Vertical,"Michael, picks up an Englishman in the middle of a Transylvanian forest. The ghost of a former jester, places him in some unimaginable situations. Despite being a believer in non-violence, Michael is forced to become a serial killer.",Fantansy
183,184. The Slave and the Sorcerer,Two sisters are thrown out of their isolation and onto opposite coasts of America by a terrifying cosmic entity. On their quest to reunite they discover their own supernatural abilities and meet many strange characters.,Fantansy
184,185. Turma da Mônica Jovem: Reflexos do Medo,"Lured to a remote farmhouse by a deceitful relative, a young family fall victim to malevolent fairies who need sacrifices to renew their magical life force.",Fantansy
185,186. The Jester from Transylvania,"Ebenezer the Traveler continues the journey of the famous Ebenezer Scrooge following the events of ""A Christmas Carol"". In this untold twist, Ebenezer Scrooge is now enlisted as one of the spirits to help those in need.",Fantansy
186,187. Spirit Riser,Tulhan and his family contract a fatal disease. Tulhan goes on a dangerous journey for treatment. He reaches Shahmeran with this journey.,Fantansy
187,188. The Evil Fairy Queen,"The Tsar is having his daughter Zabava marry a charmingly handsome and a handsomely charming Paul, a rich heir and a foreign fancy pants. However, it's a bit of a challenge, since Zabava wants a marriage of love, not of calculation. Her unexpected encounter with sailor Ivan, a simpleton yet an honest and endearing guy, messes up Paul's plans of snatching the crown. Deeply in love with the princess, Ivan enlists help from the residents of an enchanted forest to build a Flying Ship which would then take him and his beloved away. The brave sailor is in for serious confrontation with the sneaky Paul, who's using dark magic to bring his unwanted opponent down. However, true love is going to win this battle: with the evil mastermind punished, Ivan and Zabava step aboard the magic Flying Ship and set sail towards a new common dream of theirs.",Fantansy
188,189. Ebenezer: The Traveler,"Half-alien Teh'a flees across galaxies, hunted by a race of parasitic rulers disguised as Earth's vampires. With rebels by her side, she seeks a legendary creature: the earth goddess, powerful enough to end their reign of terror.",Fantansy
189,190. Sahmeran Efsanesi-Tulhan,A quick trip through the underground party scene as seen through the memories of eight people coming back to reality.,Fantansy
190,191. Letuchiy korabl,"During the Crusades, Joachim's monastic habit has become like a second skin. Enveloped by the darkness of the world, his life intertwines with dreamlike experiences and mystical visions. A river of oil appears before his eyes. The ascetic receives divine revelations, prophecies, and visions that only his heart can unveil. His final endeavor is humanity's greatest challenge: to overcome the apocalypse.",Fantansy
191,192. Vampire Genesis,"An animation anthology film project telling four interlinked tales of animated sci-fi and fantasy by directors from Japan, China and New Zealand that talks about war, life, love and what we are as human.",Fantansy
192,193. Universal Groove,Group of people find themselves trapped in States from Zombies.,Fantansy
193,194. Joachim and the Apocalypse,"Joba and Quincy are a wealthy Brooklyn couple who value charity above all. But when a friend returns from a country pilgrimage to challenge their bleeding hearts, they accept an invitation that will change their lives forever.",Fantansy
194,195. Taisu Xilie,"Legend says that long ago, nature thrived in harmony around the lake, until evil arrived. Men, blinded by dark desires, brought fear, hate, and death. Fishermen call it La Miringua, the one that drags you in the lake for your sins.",Fantansy
195,196. The Epidemic,"Across three different time periods, a man stages a play to win the heart of his infatuation, Sumalatha, only to face disapproval from her father.",Fantansy
196,197. The Woods Are Real,The story follows the team as they try to raid a tomb made by master tomb raiders. It is set partially in Russia and will involve scenes at Catherine Palace in St. Petersburg.,Fantansy
197,198. Un cuento de pescadores,"The Raimon Junior High soccer team, led by the protagonist Endou Mamoru, aims to win the national tournament, Football Frontier. Thanks to the efforts of legendary striker Gouenji Shuya, who joins the team, they beat strong schools and make it through the regional qualifiers despite fierce battles. With their former rival, Teikoku Gakuen's genius game maker Kidou Arihito, now on board, Raimon Junior High School advances to the finals, but they are faced with the overwhelming strength of Zeus Junior High!.",Fantansy
198,199. Sureshinteyum Sumalathayudeyum Hridayahariyaya Pranayakatha,"Music student Minato, struggling with trauma, meets pianist Yukino and is drawn to her innocent charm and playing. As they bond, she helps heal him, but Yukino suddenly vanishes from his life.",Fantansy
199,200. The Legend Hunters,"Follows Komugi and Iroha on a new adventure, when they are sucked into the world of the video game Doki Doki Tanukingdom (Thrilling Raccoon-Dogkingdom).",Fantansy
200,201. Inazuma Eleven Movie: The Legendary Kickoff,"The journey of Prasanth and Sruthi, a married couple navigating the complexities of their relationship through joyous highs and challenging lows",Fantansy
201,202. Ienai Himitsu,"Nie Xiaoqian was betrayed and died with hatred. She turned into a ghost after death and was imprisoned in Lanruo Temple. Ning Sheng went to Capital to take examination and stayed here, and accidentally saved Xiaoqian.",Fantansy
202,203. Wonderful Precure! The Movie! Doki Doki Game no Sekai de Daiboken,"An untold bedtime story following the simple life and trade of a Heartsmith who spends his days mending the broken hearts of people suffering from sadness, brought to him by the mysterious Umbrella Man.",Fantansy
203,204. Wedding Diaries,"Shortly after a number of mysterious and vicious murders, a retro Virus is unleashed that uniquely infects the youth of a highly populated city. Groups of children become infected, deadlocked and highly contagious; resulting in an epidemic. The uninfected attempt to Escape the city from the undead, whilst the Elite Group law enforcement agency, set out in the field to investigate the source of the viral syndicate.",Fantansy
204,205. Nie Xiaoqian,"Moira and Letizia, two modern witches with a dark secret, perform a ritual every Blood Moon with a man serving as a crucial element of their magic. However, tonight something will change, the chosen one threatens to unravel their orchestrated plan. With their power and lives at stake, Letizia and Moira must face unforeseen forces and their own inner demons. Surprisingly, the bond between them might be stronger than any spell, perhaps destined to last for all eternity.",Fantansy
205,206. The Heartsmith,"After being abandoned at the altar by Laura, Marco Antonio, who always thought he was a perfect fiancé, begins to time travel whenever he hears the couple's favorite song, ""Evidências.""",Fantansy
206,207. Case Files,"Running from police, a small time thief finds a refuge in an abandoned video store. Forced to spend night there he decide to watch three horror films.",Fantansy
207,208. Bloody Mary,"A huge spaceship materializing over Tokyo initiates a contentious war with seemingly harmless aliens. However, high school students Koyama and Nakagawa act unaffected, prioritizing their daily routines.",Fantansy
208,209. Il ladro di stelle cadenti,Bheem and his gang travel to the past to king Damyaan and stop him from being immortal.,Fantansy
209,210. Traces of Love,"Helena suffers the loss of her parents. Between mourning and abandonment, she receives through dreams, messages that will make her delve into herself, and at the same time, follow the strange trail of someone who will change her existence.",Fantansy
210,211. Videotheque,"Darth Vader finally arrived at Korriban to unlock it's secrets to himself. And he has Jakkai locked away in his super star destroyer, tempting him to turn to the darkside of the force.. Gordon along with Grogu, try to save him.",Fantansy
211,212. Dead Dead Demon's Dededede Destruction,"A man goes in search of some urgently required answers to the world of Bhairavakona, from which there's seemingly no way out.",Fantansy
212,213. Chhota Bheem and the Curse of Damyaan,"Zenitendo is a mysterious candy store that only lucky people can reach. All the candy recommended by the owner of the store, is perfectly suited to the buyer's troubles. However, the candy might bring happiness or misfortune.",Fantansy
213,214. Mephisto,"A shy barista's life transforms when a magic wig turns him into drag queen Maxxie LaWow, tasked with finding missing queens held by Dyna Bolical who wants their anti-aging tears.",Fantansy
214,215. Sith Wars: Episódio III - Fantasmas Dos Sith,Ingrid is a lonely contract killer. She never fails. She leaves no trace. No one knows her origin.,Fantansy
215,216. Ooru Peru Bhairavakona,"Don Arif who is an extraordinary shaman and comes from a lineage of famous shaman. As a social media 'influencer', he often thinks of new ways to gain popularity. With the help of Jaafar, his senior assistant, they managed to 'cure' a woman who was possessed while the Shaman Convention was going on. The ceremony then went viral and since then Don Arif has become famous. So began a new journey of his life with a high demand to use his services.",Fantansy
